{
  "bundle_id": "0192b3c4-5d6e-7f80-9a1b-0000000000b0",
  "created_at": "2026-09-16T13:00:00.000Z",
  "delegations": ["0192b3c4-5d6e-7f80-9a1b-0000000000d0"],
  "exporter": {
    "agent_id": "H342ugmg0Ea-GvTpUDeqxqFKsgeirlcywX047EFubuU",
    "software": "sealedrun-vectors/0.1.0"
  },
  "files": {
    "anchors/0192b3c4-5d6e-7f80-9a1b-000000000007.json": "vauIeEg3DdtCLQedoQvq_Z3Q5rlwbdW_8Dk76oVjk6s",
    "delegations/0192b3c4-5d6e-7f80-9a1b-0000000000d0.json": "TqFFfzerLtENUXMYwNA6gUKFe-tOBaZaExt7EKeIHyw",
    "payloads/sha-256/AVQROTn3QHBTf9D6upBcPRG5KoyXzyqUKzd9s04YzoQ": "AVQROTn3QHBTf9D6upBcPRG5KoyXzyqUKzd9s04YzoQ",
    "payloads/sha-256/Jm6tzdPGE57XeprZfJhxH5wsgsTf-czFs0fwo4ywM6E": "Jm6tzdPGE57XeprZfJhxH5wsgsTf-czFs0fwo4ywM6E",
    "payloads/sha-256/NE7Pa20znmfVURQkSpZ0rJeNoY0Pg1xXL5G5kZq6RXI": "NE7Pa20znmfVURQkSpZ0rJeNoY0Pg1xXL5G5kZq6RXI",
    "payloads/sha-256/XjL1syPgfHW5DsNxjpV1JydeH25Up6I6k5uB4sAfnp8": "XjL1syPgfHW5DsNxjpV1JydeH25Up6I6k5uB4sAfnp8",
    "payloads/sha-256/n6zrlnqzR23iJU3RGI_0RJiFw8Va196NqWza-Nitdq0": "n6zrlnqzR23iJU3RGI_0RJiFw8Va196NqWza-Nitdq0",
    "payloads/sha-256/tzkNu7TAkYjO0GgxHQm7kHiLKuzk_KKERAttOaarNKA": "tzkNu7TAkYjO0GgxHQm7kHiLKuzk_KKERAttOaarNKA",
    "runs/0192b3c4-5d6e-7f80-9a1b-0000000000a0.jsonl": "-aFNnTXWKPafeI1khwwP_FA3BBDDr8rc4Srp1bWDyys"
  },
  "hash": "154b77511ca70e6544c293d15dfe0dc803760a9b1af00f71a5708447659fcdbb",
  "hash_alg": "sha-256",
  "principal_id": "qJtRVbgIsIjNNo6VuDr6nQ50Wj3rwEAAuR2e385pby8",
  "principal_signatures": {
    "ed25519": "yog3_wot8KLjgGbYoXuPfV1bBtsyn36zE0JKKCtoNzrKXn-wi-YG_gFJkmwtq_muOqwRZVI84YOiZGQVN85uDQ",
    "ml-dsa-65": "qIoBfMOS5aizmfDc38sxktBHW0mXc68U6I8RoJs12Tj0xjvGiq7peC3Ee1So5zufEVUlCeT9KuwDoK2rLiHidPv5MV8KmU8nKub87jFfb82Rzk8PBBwUT4FTVUwoFvOmcbkr6SznaJq6lGw53tmywUUzBDoTVpTYQFn5BxGvJpVsCWou4FazASGyAAo7JSa6gXcmUaXuCFv_jJ05gZWJbUl20Qmu2TTEVo6croo62v4_bN1vvoGfdn-f4QMnvjmeHU-jjEY3zZZhAP6B6QrTIG7EQjpP7WouRNP1LKpABpLutByDg6CIwL4YYi-WkbzWRfmfLu2AjDqmgnVXbfvD0ScpZ4r4T7--qcICwEFTmed0fmqJpiTO4ei2LgxKD4zDxfP05P9F4ALdszBsZ80aqOezFOS5s3tqbj9-T7jW9mYa3WfznTGw7EKwnddlaLCh70mbNL-RYBTjqrwgvG83vraVGwrg1J5VROOjssyTkabtr_LAaFwsHPg4POkcwivIfJMxoksigfy2I0HKI3YrYQT6jekku8ijf-AGYvQHoA3lmXAD-9eqzBI930UhHwsmRFcSteKy1i_mz01SGTZj9EdNvfUfahTWCMmMYHMsEWUfqBSjJmt8_dMjgJ8GzJEBLaMPB_P3ryDlV4u7aJjQLGcNBBMIh2GR02CKlbRM5CqkvixHPNSlbHF6mVE2CA3yCS3b5rrPhvUbo21eBhDl-U_OErpTr-ra_asxe-h8Rk1K1GMc4FWmRFXbTfmunEOxQCDxjnC6_yw0XZqzhp9L6fb1odp1pHZs6dBpmXMnDY1AlFl3H2muK4EkbZwR9CMZ5qopZqzT5MKOIj0D0Oh4-2XRCWvsH5sfuAK5rnw3lIc0N80IIsOH4mrIoSsi6WCkKS1fyF54KtFXPUenN68pDZL_gfcHC5DjjeBfwc_gBMKpl9xMavTw9mL29uJll9P17qDnr87K0Hw3YALDL8ogEHr0exsPVw4gpJj7GXvZzSLDkioMTA3h3sF0R_3lF1aWg5cngs65z0Q_GwQztMuOFht7NVGGQs0L3OUgQIqa2AshniSEZZU6ydYvPnZu56FEjSBfmdpVgpMJ9tCa4oBP4yZGYrOgl9KvEjC75J7Pnyyo-0dY1Py2LER3r6Mm6Wcv1K3Rdj9jzRPc2fq6HvhUdeLEFcmhbK3f0QpItVsuNHKvRgsX-qfx10bTpWio60Sie2ZV4NyaqMLrGR2xeTvfIs7zcL_2Bw3u8ib-vuIAW58icOzOQ7g4lXw9-bT37eXv1L6CuVzWwBqLrm1mWFGQejrfxqK0zE4GlUq_4_o-epl7pr7JokfwA_IxByrxQnHR3hXKWupY_JOZuEkGyFByj7FEJAdqzmpfeEVMCAqrZh3I4h-cHRud0bXqfq3w8YJuk8gmj5lDlFEXTJX6u7aFZpoXMM6Y0-kq5ZW39P99ltZDzIoGXeK2yadQcQ5fhGrg_WZ8Fqg7zTeG7gIHIXvN8ALZnsLyBg7DskcwtGADgKeUJv4LeuMtegyb0TZigVsv9kFCOW3p8wlxEI4jlmWZ6qPfx2816_oJUTJ8iNLFpb3t31h492LccyB-S0yht6krm4l9gJ96rSuXgGGDI9Q0KJWdZ8UQ7dvb-CwhtJ9NLhWYqEWGWnHbdOJe5xIErpl1yyqH_r2zjkYSWYXxruOtfS00Q7FwOnygX50tLXaqTLcZC_yy7UG-_r3qwq84eira8ZmYlUj1glIGXiMOxBlzvFFZpl418k5nlELJc5rntmKmEqriBtI6B-Gp3OmEZBhRynRFav3q_7Xd-wXb8i9L9JCZr3FudLs5sfAk98HaG9Ked5d8EYC9GNuC9JeLLy_7GBLnPOAOg0TgFRRju4LJYbgv09YIZ2KX4RpqZbl6xJjfdCi7_F4UE4vzYeqFNfJR6IZCeiMkPCR4FwOMXflQ-7-L8DY-Eqi_JPyi9oAPSiYb7QQblLQ14_Re_gaP6mdzzEl9RIXk_k0DU0Jiq7sJ2JmYDze2ttDeIlMpNK8LiB6TBkecR-KjpXpWO37MbAgS2MC35Bhf93wgCyI51s6f-k2NgBK7cn5MKXDlD1zBqGi7KXP9H0-EMEyUKFtu8U1sEbSKN-eUAcX9wFRcumoN-KCACCi-xOASD5RintY4fB7pdxzdBu3IpwhUnfRJvA40hzDdjzv46Lka80_HY7U5bjEPYhQemOvxK1Wn5gd11UN_UMa13-3gLPuNTFM2fdHgP9d_NKArYYZxfhdQksIuFBNEI3jUVw8BJexLlGo0l3FbsEIcvKjnwb7GOrhllhB5qp3Dr63WUyyKmjlzRnhHB1e6jLBwdxwDUlrs4Qv1TkBwMITvxlfnVO8vhDKPOzYsOYNjfOoiSZTmCf7WPVTzG1vN4t1plwAj289LxyfQJAdKiufptaLcZ-9jK5aPm93IMUztqi8O5GeweOjzi-vNZRZYzgPYEsXsGLQoHesXmjvlwISIrZa2cGdpPmWSWwoFjzMt60YklJiduksRGMraAiUBLmzZv4V8WuhS5FmDy0sge-k9_kVRX1EgnhBzntBWuT4GpgUUFxlq9NzVSldaf0wFs3JvRSCnvGKe3AfhTYySpiWjjNFgrrFeutGLdwIrMFfPo5zNdu8NEfkTloDfyV12D0Q7S03Dz5tWgOkTCcmXdfc_d5_ZH642j2F2KFNKQfrRYr8Bez-BbS-2YfLgGCeIn2siglbAGqGrxi4CuV75gUP322c7kcM0mML0yHyUmSYzCLUKeahCc0DgXQytuI9YgN99ERri5f3QwuAz24UCYSWE-cwxrBnLfK_qg7myrXvKRWNKt0ATIrXbnXBlzYn8nmWHLpI90qUrSKYB7c2FAOk97PzZZZaF0tZ8TJYlOcpHNKD0xYAcEkszB-Vb7fHB2n3ej5mE5aV5kuZQuVOh7sMgtYG-8y08NW7FewL72_CZkIVS7OghL8WsTu6iiUdOusf3fJ2zmUBMIkb7oADK6qX8EKtxnp70JvhfioXupUNY_HtuK-ZwZJALjgZBrxOBH-a1RTOh2WI5PPp5PtCvjSBPGu5kAygC0U9ZQQXH9b_efGJSed4pY1Rrdotr4qSVAxX0GvgLyyZlyXUmPpz-ABOjwaLW5rV4ZvoQ0sG8I_ckAiaSfEOdt97ofIj7xDRr_3yItmK7-k8DfWOUMBYMQNLXCWnOpLxsj3nDzuicPtlzD8iU2YoVU4xb8pl4vzCF1N9CxQ9yEQgXgFfjhKGCYM9dfR1hSoC1XYmqD0g1kr79Gbtl0ffdBGuQvr4vuicb5MZiixBE8NelQS8O337l2QVs0M26BkrvQvLmO_a7kogkgv3-BUmlSbEGfZifs7VZPVd3aeDF7nls1GEONsffwXxF1vZ_S0MPCmhoats-GyOEicZbMEAmLc-mTUi10AXMW9JfTW_tBddrkDhLjzdl6NQfHlgQOMsl5vZigI8sRSX33HSS8mbtdvZi0TJjHPnQDQAlSM5-ZvsQ-9Kh4GdvSfGwysgSF_AxHck8NyTM1_iL9P4tjw8KciNOy5clN5fZRq2t5P1vBpmd-Q25pHKePSibqAwyjrxq8Pz7vPg24TSbg7jbvD3Ysq-mzGRj4Y5maL-u9CBBjgSqB0Ru9tcd0hf-mGYbCvmd-v3HQmvZHhfCtqgeqHkZcdk6dphPWIszH1lt2I6voNiXoCvh8ZI_6bV92BSWguGH6ZYmSe0aisjwGvtXuJyKcST8I5uTkJrwrL1yReVornHwHB6UIVYXMh4moIWkWE5oy77G5d5YsCHooc06FkEGRwDAL9fnbl_xaHBtze5GtzmGHGohgo9qvlYkrKck601CtRB_ob585AMI7pdOoTBTI5SbnhdWkdvwkqNu5PsREjOsGq69wE-M0EtNuPu22LwWjJIdfeFgB217M_T9sT5x87HBXbpNus33NANC4iFcofuG9y_6DtneRwLHORUb1APCMF13QCVAjOri3tpvJ_qBMdSAY0-W3rddAxeOsiuWVb6UXyFW92XmEDE8TvgDwfI6zm4Y7b2cdKUap98ie21CkErBsofG4aV0vKsuu8UuBFpp14BlTGtaBJVTICZXXtnF24HCyBy-g33xZwKE6SueKcCiVQNXEjNroEyZIZ6MBnPCg8Ax5NM7BeZ8Z-QsRxq7_JpQedcYQlQblG1Dg_AuAS3ppQmoEqCf5hgTlZfNsAEuh4ZXJIjkINE8FSFf2JTowQWVI5TbohkplGIKcMwiD4rLM6_E4j8dWBd--kCS44zyIIBCvjY9-lHV8ecExuCdaI3A0F_R8KdnRtVh8kKqmwJ6uhCWFs9CzyKXsmJSDTCDM4zby58BEB1Zh6AzQ0bb3O4qMUeTm9Hy_x42Wrbe3-UbL3aZn8rcfqXV7QAAAAAAAAAAAAAAAAAAAAAABgwUGyIm"
  },
  "runs": [
    {
      "complete": true,
      "first_hash": "0000000000000000000000000000000000000000000000000000000000000000",
      "first_seq": 0,
      "hash_alg": "sha-256",
      "last_hash": "3796a22df4bd88762055cb829f5b237772e357c1950a75da3c409348b4fb6da1",
      "record_count": 9,
      "run_id": "0192b3c4-5d6e-7f80-9a1b-0000000000a0"
    }
  ],
  "signatures": {
    "ed25519": "6jQUSxclNrbwf_8KoDubEIAxjP5aS7A_dBpGwt1JkpnntQ77lnnNEmmChCz7FXFWHwXRZZgbN5TzKltZbURhAg",